<?xml version="1.0" encoding="UTF-8"?>
<ClassData Name="DesignerHeiner" xmlns:xsi="http://www.w3.org/2001/XMLSchema-instance" xsi:noNamespaceSchemaLocation="ClassData.xsd">
	<DerivedFrom Name="DesignerBase"/>
	<DerivedFrom Name="IDesigner"/>
	<Fields Name="data" Scope="fucked" IsStatic="false" ValueType="int"/>
	<Fields Name="ytext" Scope="private" IsStatic="true" ValueType="string"/>
	<Fields Name="drittes" Scope="private" IsStatic="true" ValueType="string"/>
	<Fields Name="viertes" Scope="private" IsStatic="false" ValueType="string"/>
	<Properties  Name="TestText" Scope="public" ValueType="string"/>
	<Properties Name="TestText" Scope="public" ValueType="string"/>
	<Methods Name="DesignerHeiner" Scope="public" ReturnType="void" Signature="string, int" Parameternames="name, counter" IsConstructor="true"/>
	<Methods Name="ToString" Scope="public" ReturnType="string" Signature="void"/>
</ClassData>
